{"$id":"https://pq-rbbc.invalid/schema/cap-unified-tree-contract-technical-review-status-v2.43.json","$schema":"https://json-schema.org/draft/2020-12/schema","additionalProperties":false,"properties":{"completed_at_utc":{"minLength":1,"type":"string","x-canonical-utc":true},"contract_version":{"const":"2.43","type":"string"},"decision":{"const":{"authorizes_production_prefreeze":false,"authorizes_real_operator_reservation":true,"blocking_findings":[],"disposition":"passed_no_blocking_findings","grants_security_claim":false,"is_ai_assisted_technical_review":true,"is_named_independent_human_approval":false},"type":"object"},"external_review_artifacts":{"additionalProperties":false,"properties":{"findings":{"additionalProperties":false,"properties":{"bytes":{"minimum":1,"type":"integer"},"filename":{"minLength":1,"type":"string"},"sha256":{"pattern":"^[0-9a-f]{64}$","type":"string"}},"required":["filename","bytes","sha256"],"type":"object"},"inventory":{"additionalProperties":false,"properties":{"bytes":{"minimum":1,"type":"integer"},"filename":{"minLength":1,"type":"string"},"sha256":{"pattern":"^[0-9a-f]{64}$","type":"string"}},"required":["filename","bytes","sha256"],"type":"object"},"report":{"additionalProperties":false,"properties":{"bytes":{"minimum":1,"type":"integer"},"filename":{"minLength":1,"type":"string"},"sha256":{"pattern":"^[0-9a-f]{64}$","type":"string"}},"required":["filename","bytes","sha256"],"type":"object"}},"required":["report","findings","inventory"],"type":"object"},"format":{"const":"PQRBBC-CAP-UNIFIED-TREE-CONTRACT-TECHNICAL-REVIEW-STATUS-1","type":"string"},"reviewed_commit":{"pattern":"^[0-9a-f]{40}$","type":"string"},"reviewed_contracts":{"additionalProperties":false,"properties":{"contract_source":{"additionalProperties":false,"properties":{"bytes":{"minimum":1,"type":"integer"},"filename":{"minLength":1,"type":"string"},"sha256":{"pattern":"^[0-9a-f]{64}$","type":"string"}},"required":["filename","bytes","sha256"],"type":"object"},"manifest":{"additionalProperties":false,"properties":{"bytes":{"minimum":1,"type":"integer"},"filename":{"minLength":1,"type":"string"},"sha256":{"pattern":"^[0-9a-f]{64}$","type":"string"}},"required":["filename","bytes","sha256"],"type":"object"},"schemas":{"additionalProperties":false,"properties":{"approval_record":{"additionalProperties":false,"properties":{"bytes":{"minimum":1,"type":"integer"},"filename":{"minLength":1,"type":"string"},"sha256":{"pattern":"^[0-9a-f]{64}$","type":"string"}},"required":["filename","bytes","sha256"],"type":"object"},"independent_review":{"additionalProperties":false,"properties":{"bytes":{"minimum":1,"type":"integer"},"filename":{"minLength":1,"type":"string"},"sha256":{"pattern":"^[0-9a-f]{64}$","type":"string"}},"required":["filename","bytes","sha256"],"type":"object"},"resource_reservation":{"additionalProperties":false,"properties":{"bytes":{"minimum":1,"type":"integer"},"filename":{"minLength":1,"type":"string"},"sha256":{"pattern":"^[0-9a-f]{64}$","type":"string"}},"required":["filename","bytes","sha256"],"type":"object"},"technical_review_status":{"additionalProperties":false,"properties":{"bytes":{"minimum":1,"type":"integer"},"filename":{"minLength":1,"type":"string"},"sha256":{"pattern":"^[0-9a-f]{64}$","type":"string"}},"required":["filename","bytes","sha256"],"type":"object"}},"required":["technical_review_status","approval_record","resource_reservation","independent_review"],"type":"object"}},"required":["contract_source","manifest","schemas"],"type":"object"},"reviewed_tree":{"pattern":"^[0-9a-f]{40}$","type":"string"}},"required":["format","contract_version","reviewed_commit","reviewed_tree","completed_at_utc","reviewed_contracts","external_review_artifacts","decision"],"title":"PQ-RBBC v2.43 reservation-binding technical review status","type":"object"}
