{"completed_at_utc":"2026-09-10T18:17:29Z","contract_version":"2.43","decision":{"authorizes_production_prefreeze":false,"authorizes_real_operator_reservation":true,"blocking_findings":[],"disposition":"passed_no_blocking_findings","grants_security_claim":false,"is_ai_assisted_technical_review":true,"is_named_independent_human_approval":false},"external_review_artifacts":{"findings":{"bytes":14228,"filename":"findings.json","sha256":"098f14b9c75f885ec11219b83c0382df08ce0546c979221bf33cd60fb2eb8f08"},"inventory":{"bytes":2724,"filename":"SHA256SUMS.txt","sha256":"8b716da32a005f64cebe3a4eec1dcfe7bcfa217458d4380dc37fed99e6114f24"},"report":{"bytes":19834,"filename":"AI_TECHNICAL_REVIEW_zh-TW.md","sha256":"9dc3c785c37afae4390ae20bc9b15313fdba4491bfb95c5a326465d75896a5fe"}},"format":"PQRBBC-CAP-UNIFIED-TREE-CONTRACT-TECHNICAL-REVIEW-STATUS-1","reviewed_commit":"073582c948f1386908568bad85d2ea71bcad06e3","reviewed_contracts":{"contract_source":{"bytes":56090,"filename":"pq_rbbc_cap_unified_tree_reservation_binding_v2_43.py","sha256":"a57fbe461954b06e8412b599faaf111894a6fbae345950448eec55ec9c3218b2"},"manifest":{"bytes":5801,"filename":"pq_rbbc_cap_unified_tree_reservation_binding_manifest_v2_43.json","sha256":"89c5a6678b0d07459bc34a41c6331067327b8cbaa36e78f11e038767fc972273"},"schemas":{"approval_record":{"bytes":1379,"filename":"pq_rbbc_cap_unified_tree_operator_approval_v2_43.schema.json","sha256":"304019fd1608c5646639a5aae58133c0e6d8d1b967b7129347ce514dfef7d152"},"independent_review":{"bytes":6156,"filename":"pq_rbbc_cap_unified_tree_independent_review_v2_43.schema.json","sha256":"3ed258783dbfadf2a0d9dcd5f98b2a7c04fe8435b22d3b61bb5680f7d45a8cfe"},"resource_reservation":{"bytes":7573,"filename":"pq_rbbc_cap_unified_tree_resource_reservation_v2_43.schema.json","sha256":"6829d83b5437e2c8d0e1ed96f0c5e636fb6b286db0211f38c32283a9bce8a97e"},"technical_review_status":{"bytes":3833,"filename":"pq_rbbc_cap_unified_tree_contract_technical_review_status_v2_43.schema.json","sha256":"ef6d1b5ea9da17ca29791d10450dc62378addaa6be1f31b9732e3a36aa8d34b7"}}},"reviewed_tree":"984abc3e07092562fe01aad5b37d4ce4abcbd25c"}
